Column,Label,Comment,Note,Target,Attribute,attributeOf,Unit,Time,Entity,Role,Relation,inRelationTo,wasDerivedFrom,wasGeneratedBy,hasPosition
SEQN,"Respondent sequence number","Respondent sequence number.",," Both males and females 12 YEARS - 17 YEARS",,,,,,,,,,,
ALQ010,"Age when first drank alcohol","English Text: The following questions ask about alcohol use. This includes beer, wine, wine coolers, and liquor such as rum, gin, vodka, or whiskey. This does not include drinking a few sips of wine for religious purposes. How old were you when you had your first drink of alcohol, other than a few sips?","VERBAL INSTRUCTIONS TO SP:  Please select one of the following choices."," Both males and females 12 YEARS - 17 YEARS",sio:Age,,,,,,,,,,
ALD020,"# days drank alcohol over lifetime","During your life, on how many days have you had at least one drink of alcohol?","VERBAL INSTRUCTIONS TO SP:  Please select one of the following choices."," Both males and females 12 YEARS - 17 YEARS",sio:TimeInterval,,obo:UO_0000033,,,,,,,,
ALD030,"# days drank alcohol over past 30 days","During the past 30 days, on how many days did you have at least one drink of alcohol?","VERBAL INSTRUCTIONS TO SP:  Please select one of the following choices."," Both males and females 12 YEARS - 17 YEARS",sio:Quantity,,obo:UO_0000033,,,,,,,,
ALD040,"# days w/5 or more drinks/past 30 days","During the past 30 days, on how many days did you have {DISPLAY NUMBER} or more drinks of alcohol in a row, that is, within a couple of hours?","INSTRUCTIONS TO SP: Please select one of the following choices. CAPI INSTRUCTION: IF SP = MALE, DISPLAY = 5 IF SP = FEMALE, DISPLAY = 4."," Both males and females 12 YEARS - 17 YEARS",sio:Quantity,,obo:UO_0000033,,,,,,,,
